{
  "reportType": "master-baseline",
  "generatedAt": "2026-03-14T00:00:00.000Z",
  "constitutionVersion": "1.4.0",
  "scope": {
    "branch": "master",
    "commit": "0000000000000000000000000000000000000000"
  },
  "assessments": [
    {
      "clauseId": "I.local-first-non-negotiable",
      "clauseTitle": "I. Local First (NON-NEGOTIABLE)",
      "status": "compliant",
      "rationale": "No non-compliant evidence detected for this clause in baseline assessment."
    }
  ],
  "findings": []
}
