{
  "reportType": "local-delta",
  "generatedAt": "2026-03-14T05:48:08.773Z",
  "constitutionVersion": "1.4.0",
  "assessments": [
    {
      "clauseId": "I.local-first-non-negotiable",
      "clauseTitle": "I. Local First (NON-NEGOTIABLE)",
      "status": "compliant",
      "rationale": "No local delta evidence indicates a constitutional regression for this clause."
    },
    {
      "clauseId": "II.ux-first",
      "clauseTitle": "II. UX First",
      "status": "compliant",
      "rationale": "No local delta evidence indicates a constitutional regression for this clause."
    },
    {
      "clauseId": "III.test-first-non-negotiable",
      "clauseTitle": "III. Test-First (NON-NEGOTIABLE)",
      "status": "compliant",
      "rationale": "No local delta evidence indicates a constitutional regression for this clause."
    },
    {
      "clauseId": "IV.quasar-design-system-compliance",
      "clauseTitle": "IV. Quasar Design System Compliance",
      "status": "compliant",
      "rationale": "No local delta evidence indicates a constitutional regression for this clause."
    },
    {
      "clauseId": "V.mmex-schema-compatibility",
      "clauseTitle": "V. MMEX Schema Compatibility",
      "status": "compliant",
      "rationale": "No local delta evidence indicates a constitutional regression for this clause."
    },
    {
      "clauseId": "VI.typescript-strictness",
      "clauseTitle": "VI. TypeScript Strictness",
      "status": "compliant",
      "rationale": "No local delta evidence indicates a constitutional regression for this clause."
    },
    {
      "clauseId": "VII.ci-cd-github-pages-deployment-discipline",
      "clauseTitle": "VII. CI/CD & GitHub Pages Deployment Discipline",
      "status": "non-compliant",
      "severity": "High",
      "evidence": [
        {
          "filePath": ".github/workflows/release.yml",
          "line": 1,
          "clauseId": "VII.ci-cd-github-pages-deployment-discipline",
          "observation": "GitHub Pages deployment workflow is not present in current CI definitions.",
          "impact": "Public demo deployment discipline cannot be guaranteed from CI."
        }
      ],
      "rationale": "No Pages deployment signal found under /workspaces/mmex-pwa/.github/workflows."
    },
    {
      "clauseId": "VIII.mmex-community-acceptance",
      "clauseTitle": "VIII. MMEX Community Acceptance",
      "status": "compliant",
      "rationale": "No local delta evidence indicates a constitutional regression for this clause."
    }
  ],
  "findings": [
    {
      "findingId": "F-001",
      "clauseId": "VII.ci-cd-github-pages-deployment-discipline",
      "severity": "High",
      "summary": "No Pages deployment signal found under /workspaces/mmex-pwa/.github/workflows.",
      "dueDate": "2026-03-20",
      "recommendations": [
        {
          "action": "Add GitHub Pages deployment workflow that runs after successful master CI.",
          "verificationMethod": "Run GitHub Actions workflow and verify Pages artifact publication.",
          "expectedOutcome": "A tested build is automatically deployed as the canonical demo.",
          "milestone": "Next CI governance update"
        }
      ],
      "state": "open"
    }
  ],
  "scope": {
    "branch": "001-review-constitution-compliance",
    "commit": "05ae4d582bd5ec15dfa1838917892e2396bc063c",
    "diffBase": "05ae4d582bd5ec15dfa1838917892e2396bc063c"
  }
}
